<?xml version="1.0" encoding="UTF-8"?>
<StockAdjustment version="" xmlns:xsi="http://www.w3.org/2001/XMLSchema-instance" xsi:noNamespaceSchemaLocation="../../main/resources/xsd/i0809/CDF_StockAdjustment.xsd">
  <PostDate>2001-01-01</PostDate>
  <DocumentDate>2018-01-13</DocumentDate>
  <ArticleData>
    <ArticleNumber>Number</ArticleNumber>
    <UPC>UPC</UPC>
    <SiteId>1111</SiteId>
    <SupplierCode>1111</SupplierCode>
    <Qty>22.0</Qty>
    <UOM>UOM</UOM>
    <FromStorageLoc>111</FromStorageLoc>
    <ToStorageLoc>12c</ToStorageLoc>
    <FromStatus>FromStatus</FromStatus>
    <ToStatus>ToStatus</ToStatus>
    <MovementSign>+</MovementSign>
    <ReasonCode>ReasonCode</ReasonCode>
    <TransactionCode>TCode</TransactionCode>
  </ArticleData>
</StockAdjustment>
